{
  "schema": "assembler.projections",
  "schemaVersion": 1,
  "techId": "Nutanix.Prism",
  "displayName": "Nutanix Prism assembler projections",
  "projections": {
    "LNV.Nutanix.Prism.Target[TargetKey].Summary": {
      "renderAs": "table",
      "renderMode": "table",
      "emptyBehavior": "placeholder",
      "columns": [
        {
          "name": "Target",
          "source": "_assembler.displayName"
        },
        {
          "name": "Cluster",
          "source": "name"
        },
        {
          "name": "Native UUID",
          "source": "nativeUuid"
        },
        {
          "name": "External ID",
          "source": "extId"
        },
        {
          "name": "VM Count",
          "source": "vmCount"
        }
      ],
      "rowOrder": [
        "_assembler.objectKey"
      ]
    },
    "LNV.Nutanix.Prism.Target[TargetKey].Tables.Hosts": {
      "renderAs": "table",
      "renderMode": "table",
      "emptyBehavior": "placeholder",
      "columns": [
        {
          "name": "Target",
          "source": "_assembler.displayName"
        },
        {
          "name": "Host",
          "source": "hostName"
        },
        {
          "name": "Native UUID",
          "source": "nativeUuid"
        },
        {
          "name": "Serial",
          "source": "nodeSerial"
        },
        {
          "name": "Status",
          "source": "nodeStatus"
        }
      ],
      "rowOrder": [
        "_assembler.objectKey"
      ]
    },
    "LNV.Nutanix.Prism.Target[TargetKey].Tables.HostNics": {
      "renderAs": "table",
      "renderMode": "table",
      "emptyBehavior": "placeholder",
      "columns": [
        {
          "name": "Host NIC",
          "source": "name"
        },
        {
          "name": "MAC",
          "source": "macAddress"
        },
        {
          "name": "Speed Kbps",
          "source": "linkSpeedInKbps"
        }
      ],
      "rowOrder": [
        "_assembler.objectKey"
      ]
    },
    "LNV.Nutanix.Prism.Target[TargetKey].Tables.CVMs": {
      "renderAs": "table",
      "renderMode": "table",
      "emptyBehavior": "placeholder",
      "columns": [
        {
          "name": "CVM",
          "source": "vmName"
        },
        {
          "name": "UUID",
          "source": "uuid"
        },
        {
          "name": "Host",
          "source": "hostName"
        },
        {
          "name": "Power State",
          "source": "powerState"
        }
      ],
      "rowOrder": [
        "_assembler.objectKey"
      ]
    },
    "LNV.Nutanix.Prism.Target[TargetKey].Tables.VMs": {
      "renderAs": "table",
      "renderMode": "table",
      "emptyBehavior": "placeholder",
      "columns": [
        {
          "name": "VM",
          "source": "name"
        },
        {
          "name": "UUID",
          "source": "uuid"
        },
        {
          "name": "External ID",
          "source": "extId"
        },
        {
          "name": "Controller VM",
          "source": "controllerVm"
        }
      ],
      "rowOrder": [
        "_assembler.objectKey"
      ]
    },
    "LNV.Nutanix.Prism.Target[TargetKey].Tables.VMNics": {
      "renderAs": "table",
      "renderMode": "table",
      "emptyBehavior": "placeholder",
      "columns": [
        {
          "name": "VM",
          "source": "vm_name"
        },
        {
          "name": "NIC UUID",
          "source": "nic_uuid"
        },
        {
          "name": "MAC",
          "source": "mac_address"
        },
        {
          "name": "Network UUID",
          "source": "network_uuid"
        }
      ],
      "rowOrder": [
        "_assembler.objectKey"
      ]
    },
    "LNV.Nutanix.Prism.Target[TargetKey].Tables.Networks": {
      "renderAs": "table",
      "renderMode": "table",
      "emptyBehavior": "placeholder",
      "columns": [
        {
          "name": "Network",
          "source": "name"
        },
        {
          "name": "UUID",
          "source": "uuid"
        },
        {
          "name": "External ID",
          "source": "extId"
        }
      ],
      "rowOrder": [
        "_assembler.objectKey"
      ]
    },
    "LNV.Nutanix.Prism.Target[TargetKey].Tables.VirtualSwitches": {
      "renderAs": "table",
      "renderMode": "table",
      "emptyBehavior": "placeholder",
      "columns": [
        {
          "name": "Virtual Switch",
          "source": "name"
        },
        {
          "name": "External ID",
          "source": "extId"
        },
        {
          "name": "MTU",
          "source": "mtu"
        }
      ],
      "rowOrder": [
        "_assembler.objectKey"
      ]
    },
    "LNV.Nutanix.Prism.Target[TargetKey].Tables.StorageContainers": {
      "renderAs": "table",
      "renderMode": "table",
      "emptyBehavior": "placeholder",
      "columns": [
        {
          "name": "Container",
          "source": "name"
        },
        {
          "name": "Native UUID",
          "source": "nativeUuid"
        },
        {
          "name": "Container ID",
          "source": "containerExtId"
        },
        {
          "name": "Max Capacity",
          "source": "maxCapacityBytes",
          "format": "bytesHuman"
        }
      ],
      "rowOrder": [
        "_assembler.objectKey"
      ]
    },
    "LNV.Nutanix.Prism.Target[TargetKey].Tables.StoragePools": {
      "renderAs": "table",
      "renderMode": "table",
      "emptyBehavior": "placeholder",
      "columns": [
        {
          "name": "Storage Pool",
          "source": "name"
        },
        {
          "name": "UUID",
          "source": "storagePoolUuid"
        },
        {
          "name": "ID",
          "source": "id"
        }
      ],
      "rowOrder": [
        "_assembler.objectKey"
      ]
    },
    "LNV.Nutanix.Prism.Target[TargetKey].Tables.Disks": {
      "renderAs": "table",
      "renderMode": "table",
      "emptyBehavior": "placeholder",
      "columns": [
        {
          "name": "Disk",
          "source": "id"
        },
        {
          "name": "UUID",
          "source": "disk_uuid"
        },
        {
          "name": "Host",
          "source": "host_name"
        },
        {
          "name": "Status",
          "source": "disk_status"
        },
        {
          "name": "Size",
          "source": "disk_size",
          "format": "bytesHuman"
        }
      ],
      "rowOrder": [
        "_assembler.objectKey"
      ]
    },
    "LNV.Nutanix.Prism.Target[TargetKey].Tables.ProtectionDomains": {
      "renderAs": "table",
      "renderMode": "table",
      "emptyBehavior": "placeholder",
      "columns": [
        {
          "name": "Protection Domain",
          "source": "name"
        },
        {
          "name": "Active",
          "source": "active"
        },
        {
          "name": "Remote Sites",
          "source": "remote_site_names",
          "format": "join",
          "delimiter": ", "
        }
      ],
      "rowOrder": [
        "_assembler.objectKey"
      ]
    },
    "LNV.Nutanix.Prism.Target[TargetKey].Tables.Alerts": {
      "renderAs": "table",
      "renderMode": "table",
      "emptyBehavior": "placeholder",
      "columns": [
        {
          "name": "Alert",
          "source": "title"
        },
        {
          "name": "Severity",
          "source": "severity"
        },
        {
          "name": "Resolved",
          "source": "isResolved"
        },
        {
          "name": "Acknowledged",
          "source": "isAcknowledged"
        }
      ],
      "rowOrder": [
        "_assembler.objectKey"
      ]
    },
    "LNV.Nutanix.Prism.Target[TargetKey].Tables.Tasks": {
      "renderAs": "table",
      "renderMode": "table",
      "emptyBehavior": "placeholder",
      "columns": [
        {
          "name": "Operation",
          "source": "operation"
        },
        {
          "name": "Status",
          "source": "status"
        },
        {
          "name": "External ID",
          "source": "extId"
        }
      ],
      "rowOrder": [
        "_assembler.objectKey"
      ]
    },
    "LNV.Nutanix.Prism.Target[TargetKey].Tables.Templates": {
      "renderAs": "table",
      "renderMode": "table",
      "emptyBehavior": "placeholder",
      "columns": [
        {
          "name": "Template",
          "source": "templateName"
        },
        {
          "name": "External ID",
          "source": "extId"
        },
        {
          "name": "Created By",
          "source": "createdBy"
        },
        {
          "name": "Created",
          "source": "createTime"
        }
      ],
      "rowOrder": [
        "_assembler.objectKey"
      ]
    },
    "LNV.Nutanix.Prism.Target[TargetKey].Tables.CollectionSources": {
      "renderAs": "table",
      "renderMode": "table",
      "emptyBehavior": "placeholder",
      "columns": [
        {
          "name": "Dataset",
          "source": "dataset"
        },
        {
          "name": "API",
          "source": "apiFamily"
        },
        {
          "name": "Version",
          "source": "apiVersion"
        },
        {
          "name": "Success",
          "source": "success"
        }
      ],
      "rowOrder": [
        "_assembler.objectKey"
      ]
    },
    "LNV.Nutanix.Prism.Target[TargetKey].Tables.Relationships": {
      "renderAs": "table",
      "renderMode": "table",
      "emptyBehavior": "placeholder",
      "columns": [
        {
          "name": "Type",
          "source": "relationshipType"
        },
        {
          "name": "Source",
          "source": "sourceDisplay"
        },
        {
          "name": "Target",
          "source": "targetDisplay"
        },
        {
          "name": "Correlation",
          "source": "correlationStatus"
        }
      ],
      "rowOrder": [
        "relationshipType",
        "sourceKey",
        "targetKey",
        "correlationStatus"
      ]
    },
    "LNV.Nutanix.Prism.Group[GroupKey].Tables.Relationships": {